URL,Título,Fecha,Cuerpo
https://elcomercio.pe/economia/mercados/bolsa-de-valores-de-lima-cierra-a-la-baja-tras-el-anuncio-de-la-fed-sobre-una-nueva-alza-en-las-tasas-de-interes-rmmn-noticia/,Bolsa de Valores de Lima cierra a la baja tras el anuncio de la FED sobre una nueva alza en las tasas de interés,14/12/2022 17H31,"Redacción EC14/12/2022 17H31La Bolsa de Valores de Lima (BVL) cerró la sesión del miércoles con pérdidas, tras el anuncio de la Reserva Federal (FED) sobre la subida de 50 puntos básicos en las tasas de interés, séptima alza del año.Al término de las operaciones, el Índice S&P/BVL Perú General, el más representativo de la bolsa limeña, bajó en 0,57% con 21.394,28 puntos.Del mismo modo, el Índice S&P/BVL Perú Selectivo, que está conformado por las acciones más negociadas en el mercado se redujo en 0,90% y se colocó en 562,96 unidades.Durante la sesión se cotizaron acciones de 60 empresas, de las cuales 23 subieron, 16 bajaron y 21 no registraron variación.Los sectores que presentaron ganancias fueron: construcción (0,59%) e industrial (0,39%).De otro lado, los segmentos que presentaron pérdidas fueron: servicios (-1,08%), eléctrico (-1,08%), financiero (-0,84%), consumo (-0,69%) y minero (-0,30%).Entre las acciones locales que más subieron destacaron Aenza (13,33%), Leche Gloria (3,85%) y Pomalca (0,28%).En contraste, los que cayeron son Lux del Sur (-2,17%) y Compañía de Minas Buenaventura (-1,39%).A nivel regionalLa mayoría de las monedas y bolsas de valores de América Latina operaban con pérdidas el miércoles, tras el anuncio de la Reserva Federal (FED) sobre la subida de 50 puntos básicos en las tasas de interés, séptima alza del año.Se trata un ajuste menor comparado con los cuatro previos, no obstante, la FED ha indicado que habrá más incrementos a medida que la inflación comienza a ceder.Los responsables de la política de la Fed prevén que la tasa de corto plazo alcanzará un rango de 5% a 5,25% para finales del 2023. Eso sugiere que el banco central está preparado para aumentar las tasas en tres cuartos de punto adicionales y las dejará en ese nivel hasta que termine el otro año. Algunos economistas ya esperaban un incremento de medio punto."
https://elcomercio.pe/economia/mercados/precio-dolar-en-peru-hoy-tipo-de-cambio-este-miercoles-14-de-diciembre-compra-y-venta-dolares-a-soles-dolar-de-hoy-bcr-banco-central-de-reserva-rmmn-noticia-2/,"Dólar cierra con ligera alza en S/3,83 tras el anuncio de estado de emergencia",14/12/2022 16H38,"Redacción EC14/12/2022 16H38El precio del dólar estadounidense en Perú cerró al alza este miércoles 14 de diciembre, luego que el Ejecutivo anunciara el estado de emergencia a nivel nacional, debido a una coyuntura de constante manifestaciones y bloqueos de carreteras nacionales.MIRA: Precios de alimentos continúan subiendo en Mercado Mayorista de LimaEl tipo de cambio terminó la jornada en S/3,834 por dólar, una leve subida de 0.08% frente al cierre del martes en S/3,831, de acuerdo al Banco Central de Reserva del Perú (BCR). En lo que va del año, el billete verde acumula un retroceso de 3,93% en comparación con la última cotización de 2021, en S/3,991.Hoy, en el mercado se negociaron US$139 millones a un precio promedio de S/3,8380, indicó Gianina Villavicencio, gerente de Intermediación de Divisas en Renta4 SAB. “Durante la jornada, la demanda provino de mercado offshore, llegando el dólar a un nivel máximo de S/3,845″, señaló.En el mercado paralelo o las principales casas de cambio el dólar se compra a S/3,82 y se vende a S/3,85, según datos del portal cuantoestaeldolar.pe. En el Perú, el ministro de Defensa, Luis Alberto Otárola, anunció hoy que el Gobierno declarará el estado de emergencia en todo el territorio nacional por 30 días calendario, debido a la crisis política que afronta el país.“Se acordó declarar en estado de emergencia a todo el país debido a los hechos vandálicos y violentos, a la toma de carreteras y caminos, que ya son actos que se están estabilizando”, indicó. Por su parte, el ministro de Economía y Finanzas, Alex Contreras, estimó que el país pierde alrededor de S/100 millones diarios por estas protestas.Por otro lado, la perspectiva de la calificación de deuda en moneda extranjera a largo plazo del Perú fue revisada a negativa desde estable el lunes por S&P Global Ratings.TE PUEDE INTERESARDólarToday, precio de hoy, 14 de diciembre: ¿cuánto vale el tipo de cambio en Venezuela?Precio del aluminio y cobre caen por inquietud ante casos de COVID-19 en ChinaPrecio del oro se mantiene por encima de US$ 1,800 antes de la decisión de la Fed"
https://elcomercio.pe/economia/mercados/precio-dolar-en-peru-hoy-tipo-de-cambio-este-miercoles-14-de-diciembre-compra-y-venta-dolares-a-soles-dolar-de-hoy-bcr-banco-central-de-reserva-rmmn-noticia-2/,"Dólar cierra con ligera alza en S/3,83 tras el anuncio de estado de emergencia",14/12/2022 16H38,"Redacción EC14/12/2022 16H38El precio del dólar estadounidense en Perú cerró al alza este miércoles 14 de diciembre, luego que el Ejecutivo anunciara el estado de emergencia a nivel nacional, debido a una coyuntura de constante manifestaciones y bloqueos de carreteras nacionales.MIRA: Precios de alimentos continúan subiendo en Mercado Mayorista de LimaEl tipo de cambio terminó la jornada en S/3,834 por dólar, una leve subida de 0.08% frente al cierre del martes en S/3,831, de acuerdo al Banco Central de Reserva del Perú (BCR). En lo que va del año, el billete verde acumula un retroceso de 3,93% en comparación con la última cotización de 2021, en S/3,991.Hoy, en el mercado se negociaron US$139 millones a un precio promedio de S/3,8380, indicó Gianina Villavicencio, gerente de Intermediación de Divisas en Renta4 SAB. “Durante la jornada, la demanda provino de mercado offshore, llegando el dólar a un nivel máximo de S/3,845″, señaló.En el mercado paralelo o las principales casas de cambio el dólar se compra a S/3,82 y se vende a S/3,85, según datos del portal cuantoestaeldolar.pe. En el Perú, el ministro de Defensa, Luis Alberto Otárola, anunció hoy que el Gobierno declarará el estado de emergencia en todo el territorio nacional por 30 días calendario, debido a la crisis política que afronta el país.“Se acordó declarar en estado de emergencia a todo el país debido a los hechos vandálicos y violentos, a la toma de carreteras y caminos, que ya son actos que se están estabilizando”, indicó. Por su parte, el ministro de Economía y Finanzas, Alex Contreras, estimó que el país pierde alrededor de S/100 millones diarios por estas protestas.Por otro lado, la perspectiva de la calificación de deuda en moneda extranjera a largo plazo del Perú fue revisada a negativa desde estable el lunes por S&P Global Ratings.TE PUEDE INTERESARDólarToday, precio de hoy, 14 de diciembre: ¿cuánto vale el tipo de cambio en Venezuela?Precio del aluminio y cobre caen por inquietud ante casos de COVID-19 en ChinaPrecio del oro se mantiene por encima de US$ 1,800 antes de la decisión de la Fed"
https://elcomercio.pe/economia/mercados/precio-dolar-en-peru-hoy-tipo-de-cambio-este-miercoles-14-de-diciembre-compra-y-venta-dolares-a-soles-dolar-de-hoy-bcr-banco-central-de-reserva-rmmn-noticia/,"Precio del dólar en Perú: Sepa cuál es el tipo de cambio para hoy, 14 de diciembre",14/12/2022 13H35,"Redacción EC14/12/2022 13H35El precio del dólar estadounidense en Perú abrió al alza este miércoles 14 de diciembre, mientras aún persisten las protestas sociales y bloqueos de carreteras en el país en el gobierno de transición de Dina Boluarte.El tipo de cambio empezó la jornada en S/ 3.8405 por dólar, una subida de 0.25% frente al cierre del martes de S/ 3.8310, de acuerdo a la agencia Bloomberg.En lo que va del año, el billete verde acumula un retroceso de 4.01% en comparación con la última cotización de 2021, en S/ 3.991.En el mercado paralelo o las principales casas de cambio el dólar se compra a S/ 3.81 y se vende a S/ 3.845, según datos del portal cuantoestaeldolar.pe.En el Perú, el titular de la Presidencia del Consejo de Ministros (PCM), Pedro Angulo, reiteró su llamado al diálogo a los manifestantes que están protestando en diversos puntos del país y anunció que se conformará un “gabinete de crisis” ante las protestas.El ministro de Economía y Finanzas, Alex Contreras, estimó que el país pierde alrededor de S/ 100 millones diarios por estas protestas.Por otro lado, la perspectiva de la calificación de deuda en moneda extranjera a largo plazo del Perú fue revisada a negativa desde estable el lunes por S&P Global Ratings.TE PUEDE INTERESARDólarToday, precio de hoy, 14 de diciembre: ¿cuánto vale el tipo de cambio en Venezuela?Precio del aluminio y cobre caen por inquietud ante casos de COVID-19 en ChinaPrecio del oro se mantiene por encima de US$ 1,800 antes de la decisión de la Fed"
https://elcomercio.pe/economia/mercados/precio-dolar-en-peru-hoy-tipo-de-cambio-este-miercoles-14-de-diciembre-compra-y-venta-dolares-a-soles-dolar-de-hoy-bcr-banco-central-de-reserva-rmmn-noticia/,"Precio del dólar en Perú: Sepa cuál es el tipo de cambio para hoy, 14 de diciembre",14/12/2022 13H35,"Redacción EC14/12/2022 13H35El precio del dólar estadounidense en Perú abrió al alza este miércoles 14 de diciembre, mientras aún persisten las protestas sociales y bloqueos de carreteras en el país en el gobierno de transición de Dina Boluarte.El tipo de cambio empezó la jornada en S/ 3.8405 por dólar, una subida de 0.25% frente al cierre del martes de S/ 3.8310, de acuerdo a la agencia Bloomberg.En lo que va del año, el billete verde acumula un retroceso de 4.01% en comparación con la última cotización de 2021, en S/ 3.991.En el mercado paralelo o las principales casas de cambio el dólar se compra a S/ 3.81 y se vende a S/ 3.845, según datos del portal cuantoestaeldolar.pe.En el Perú, el titular de la Presidencia del Consejo de Ministros (PCM), Pedro Angulo, reiteró su llamado al diálogo a los manifestantes que están protestando en diversos puntos del país y anunció que se conformará un “gabinete de crisis” ante las protestas.El ministro de Economía y Finanzas, Alex Contreras, estimó que el país pierde alrededor de S/ 100 millones diarios por estas protestas.Por otro lado, la perspectiva de la calificación de deuda en moneda extranjera a largo plazo del Perú fue revisada a negativa desde estable el lunes por S&P Global Ratings.TE PUEDE INTERESARDólarToday, precio de hoy, 14 de diciembre: ¿cuánto vale el tipo de cambio en Venezuela?Precio del aluminio y cobre caen por inquietud ante casos de COVID-19 en ChinaPrecio del oro se mantiene por encima de US$ 1,800 antes de la decisión de la Fed"
https://elcomercio.pe/economia/mercados/precio-del-dolar-hoy-en-peru-cotizacion-y-tipo-de-cambio-del-viernes-30-de-junio-segun-el-bcrp-ultimas-noticia/,"Precio del dólar HOY en Perú: A cómo se cotiza el tipo de cambio este viernes 30 de junio, según el BCRP",30/06/2023 14H30,"Redacción Economía30/06/2023 14H30Conoce en esta nota el precio del dólar en Perú hoy, viernes 30 de junio de 2023, según la información que dé a conocer el Banco Central de Reserva del Perú (BCRP). Este día ha sido declarado no laborable por el Gobierno peruano para incentivar el turismo, considerando que ayer, jueves 29, fue feriado nacional por el Día de San Pedro y San Pablo.En su última jornada, miércoles 28 de junio, la moneda estadounidense cerró en el mercado peruano con un valor de S/3,6330, de acuerdo con lo informado por el ente emisor.De acuerdo con el BCRP, el tipo de cambio interbancario tuvo un valor promedio de S/3,6316, con un mínimo de S/3,6270 y un máximo de S/3,6350.Así cerró el dólar el miércoles 28 de junio#BCRP: Información del Mercado Cambiario a las 13:30 horas pic.twitter.com/nrnnzDdP5g— Banco Central de Reserva del Perú - BCRP (@bcrpoficial) June 28, 2023 Si deseas hacer el tipo de cambio en plataformas web como cuantocuestaeldolar.pe, el tipo de cambio para hoy, jueves 29 de junio, es S/ 3,62 y S/ 3,64, en compra y venta respectivamente.¿Cómo le fue al dólar en junio?En la jornada del viernes 23 de junio, el dólar cerró en S/ 3,6360, en un contexto local que mostraba un clima de menor incertidumbre y volatilidad, según Matías Maciel, cofounder de Rextie.“Estimamos que esta tendencia estable o levemente hacia la baja continúe en los próximos días. Si bien no le encontramos mucho más recorrido hacia la baja, no vemos escenarios de subas relevantes en el precio de la moneda estadounidense”, dijo.Hace unos días, el Instituto Nacional de Estadística e Informática (INEI) dio a conocer en su último informe la tasa de crecimiento del PBI de abril, la que registró una variación positiva de 0,31%.La FED mantuvo su nivel de tasa de interés en el rango de 5% a 5,25%, en línea con las expectativas del mercado.Y, finalmente, el BCR redujo la proyección de la inversión privada para este año con una contracción de 2,5% y una recuperación en el segundo semestre."
https://elcomercio.pe/economia/mercados/dolar-today-y-monitor-dolar-hoy-miercoles-28-de-junio-conoce-la-cotizacion-del-dolar-en-venezuela-ultimas-noticia/,"Dólar Today y Monitor Dólar hoy, miércoles 28 de junio: Precio y cotización del dólar en Venezuela",28/06/2023 21H36,"Redacción EC28/06/2023 21H36Revisa AQUÍ el precio del dólar en Venezuela, según DólarToday y Monitor Dólar, que se reportó con un valor de 29,7 bolívares digitales en la jornada previa de junio 2023. En esta nota podrás conocer los movimientos y el valor del dólar o billete verde en el territorio venezolano para la jornada de hoy, miércoles 28 de junio del 2023.¿EN CUÁNTO ESTÁ EL DÓLAR HOY EN VENEZUELA?El dólar se situaba en 29,7 bolívares digitales en su última jornada en el mercado informal de Venezuela, de acuerdos a datos del portal DolarToday.En tanto, Monitor Dólar cotizó la moneda estadounidense con un precio de 28,40 bolívares digitales.Asimismo, el dólar BCV (Tasa del dólar oficial) tuvo un valor de 27,61 bolívares digitales, mientras que el dólar Bitcoin llegó a 29,68 bolívares digitales.¿A CUÁNTO CERRÓ EL DÓLAR EN VENEZUELA?De acuerdo a DólarToday, en la última jornada de junio de 2023, el dólar en Venezuela cerró en 29,7 bolívares digitales.¿QUÉ ES EL BOLÍVAR DIGITAL?Es la divisa que rige en el país tras la tercera reconversión monetaria que se aplicó desde el Gobierno. La nueva medida implicó que por cada millón de bolívares soberanos se obtendría un bolívar digital o, lo que es lo mismo, se borran seis ceros de las cantidades anteriormente dibujadas.¿QUÉ ES DÓLAR TODAY?Es una compañía venezolana-estadounidense de medios de comunicación, dirigida por venezolanos que residen en Estados Unidos, que centra su atención en temas de política y finanzas de Venezuela.¿QUÉ ES MONITOR DÓLAR?Monitor Dólar es una plataforma que publica a diario el promedio del dólar en Venezuela en el mercado paralelo de divisas."
https://elcomercio.pe/economia/mercados/precio-del-dolar-peru-tipo-de-cambio-18-de-mayo-2023-noticia/,"Dólar en Perú hoy, jueves 18 de mayo: Revisa a cómo se cotiza el tipo de cambio en las apps gratuitas",18/05/2023 15H29,"Redacción EC18/05/2023 15H29Cotización del dólar en Perú | El precio del dólar en el Perú y sus variaciones diarias constituyen una de las búsquedas más recurrentes de los ciudadanos en Internet, especialmente en canales oficiales como el Banco Central de Reserva del Perú (BCRP) y la Superintendencia de Banca, Seguros y AFP (SBS).Es de sumo interés para los ciudadanos peruanos conocer el precio y tipo de cambio de la moneda estadounidense, conocida también como el billete verde, sobre todo cuando tienen que realizar una importante transacción en compra o venta de esa importante divisa.MIRA: Club de suscriptores: Aprovecha nuestras promociones en Rextie, Kambista, Dollar House y TKambio. ¿Aún no eres suscriptor? Suscríbete a El Comercio Y en el país, por supuesto, esto no es la excepción, pues los consumidores están siempre al pendiente de cuál es el precio de esta divisa y cómo va el tipo de cambio en el mercado.¿A cuánto cerró el dólar en Perú en su última jornada de mayo?El precio del dólar estadounidense en el Perú cerró el miércoles 17 de mayo a S/3,6970, según lo dio a conocer el Banco Central de Reserva del Perú (BCRP).La cotización promedio del dólar en ese día fue de S/ 3,6954 a nivel interbancario, con un mínimo de S/ 3,6900 y un máximo de S/ 3,6990, según el BCR.¿Cuánto está el dólar en Lima?Este fue el reporte de la cotización del tipo de cambio que dio a conocer el BCRP en su última jornada:#BCRP: Información del Mercado Cambiario pic.twitter.com/yCg3FlhZMg— Banco Central de Reserva del Perú - BCRP (@bcrpoficial) May 17, 2023 ¿Cómo saber el precio del dólar en apps gratuitas de cambio?A continuación, te presentamos algunas plataformas de Internet en las que podrás realizar la conversión de soles a dólares y a otras monedas internacionales.Son completamente gratuitas y fáciles de utilizar.OANDAXE.COMCUEX.COM¿Dónde ver el precio del dólar?La cotización del cierre oficial del día se encuentra en la página web de la Superintendencia de Banca, Seguros y AFP (SBS).¿Cuál es la diferencia entre el precio de compra y venta del dólar?• Precio de compra: lo que el comprador está dispuesto a pagar por adquirir el activo.• Precio de venta: lo que el vendedor está dispuesto a recibir por vender el activo.¿De qué depende el precio del dólar?El precio del dólar depende de la oferta y demanda del mercado. Qué tan difícil es conseguirlo para alguien que lo necesita y que tan fácil es venderlo para alguien que lo tiene."
https://elcomercio.pe/economia/mercados/precio-del-dolar-peru-tipo-de-cambio-18-de-mayo-2023-noticia/,"Dólar en Perú hoy, jueves 18 de mayo: Revisa a cómo se cotiza el tipo de cambio en las apps gratuitas",18/05/2023 15H29,"Redacción EC18/05/2023 15H29Cotización del dólar en Perú | El precio del dólar en el Perú y sus variaciones diarias constituyen una de las búsquedas más recurrentes de los ciudadanos en Internet, especialmente en canales oficiales como el Banco Central de Reserva del Perú (BCRP) y la Superintendencia de Banca, Seguros y AFP (SBS).Es de sumo interés para los ciudadanos peruanos conocer el precio y tipo de cambio de la moneda estadounidense, conocida también como el billete verde, sobre todo cuando tienen que realizar una importante transacción en compra o venta de esa importante divisa.MIRA: Club de suscriptores: Aprovecha nuestras promociones en Rextie, Kambista, Dollar House y TKambio. ¿Aún no eres suscriptor? Suscríbete a El Comercio Y en el país, por supuesto, esto no es la excepción, pues los consumidores están siempre al pendiente de cuál es el precio de esta divisa y cómo va el tipo de cambio en el mercado.¿A cuánto cerró el dólar en Perú en su última jornada de mayo?El precio del dólar estadounidense en el Perú cerró el miércoles 17 de mayo a S/3,6970, según lo dio a conocer el Banco Central de Reserva del Perú (BCRP).La cotización promedio del dólar en ese día fue de S/ 3,6954 a nivel interbancario, con un mínimo de S/ 3,6900 y un máximo de S/ 3,6990, según el BCR.¿Cuánto está el dólar en Lima?Este fue el reporte de la cotización del tipo de cambio que dio a conocer el BCRP en su última jornada:#BCRP: Información del Mercado Cambiario pic.twitter.com/yCg3FlhZMg— Banco Central de Reserva del Perú - BCRP (@bcrpoficial) May 17, 2023 ¿Cómo saber el precio del dólar en apps gratuitas de cambio?A continuación, te presentamos algunas plataformas de Internet en las que podrás realizar la conversión de soles a dólares y a otras monedas internacionales.Son completamente gratuitas y fáciles de utilizar.OANDAXE.COMCUEX.COM¿Dónde ver el precio del dólar?La cotización del cierre oficial del día se encuentra en la página web de la Superintendencia de Banca, Seguros y AFP (SBS).¿Cuál es la diferencia entre el precio de compra y venta del dólar?• Precio de compra: lo que el comprador está dispuesto a pagar por adquirir el activo.• Precio de venta: lo que el vendedor está dispuesto a recibir por vender el activo.¿De qué depende el precio del dólar?El precio del dólar depende de la oferta y demanda del mercado. Qué tan difícil es conseguirlo para alguien que lo necesita y que tan fácil es venderlo para alguien que lo tiene."
https://elcomercio.pe/economia/mercados/que-paso-con-el-dolar-esta-semana-tdx-tipo-de-cambioo-dolar-en-el-peru-dolar-peru-noticia/,¿Qué pasó con el dólar esta semana?,18/03/2023 08H00,"Redacción Economía18/03/2023 08H00En lo que va de marzo, la cotización del dólar se mantiene relativamente estable y esta semana los mercados financieros a nivel global enfrentaron un escenario de incertidumbre por los recientes problemas que atraviesan algunos de los bancos en Estados Unidos, como el Silicon Valley Bank (SVB), anotó Matías Maciel, CFO y cofundador de Rextie.Así, la semana inició con el dólar cotizando en S/ 3,798, un avance de 0,42% respecto al cierre del viernes anterior. Durante el día el dólar caía a nivel internacional por las expectativas de que la Reserva Federal (FED) se muestre menos agresiva con su política monetaria para frenar la inflación.TAMBIÉN LEE | ¿Cuál es la situación de los pequeños negocios en el norte del país y qué efectos se ven en Lima?“Después de que las acciones del SVB cayeron más de 81%, durante el fin de semana pasado se anunciaron una serie de medidas para estabilizar el sistema bancario y afirmaron que los depositantes tendrían acceso a sus depósitos ese mismo lunes”, explicó Asvim Asencios, trader de Divisas de Renta4 SAB.El martes, el precio del dólar cerró en S/ 3,787, retrocediendo 0,29%. A nivel internacional el cobre caía debido a la preocupación sobre el impacto de una crisis bancaria en Estados Unidos, el fortalecimiento del dólar a nivel global y una lenta recuperación de la economía China, señalaron desde Renta4 SAB.Ese día se publicaron los datos del Índice de Precios al Consumidor de Estados Unidos que impulsaron la subida del dólar.MIRA | ¿Cómo se están adecuando los grifos para la venta de gasolina regular y premium?Con un avance de 0,53% cerró el tipo de cambio el miércoles al cotizar en S/ 3,807. Ese día, el dólar ganaba posiciones debido al riesgo percibido por los inversores ante la preocupación de una mayor inestabilidad del sector bancario. “En tanto el cobre recortaba sus posiciones en 2,9%, el rendimiento de los bonos del Tesoro de Estados Unidos a dos años cayó a su nivel más bajo desde setiembre”, informaron desde Renta4 SAB.El jueves, la cotización del tipo de cambio cerró en S/ 3,788, retrocediendo en 0,5%. El euro subía a nivel internacional luego de que el Banco Central Europeo (BCE) suba en 50 puntos básicos su tasa de referencia.TAMBIÉN LEE | Daños en caminos y carreteras causan pérdidas millonarias a la economía del norte del paísFinalmente, el tipo de cambio avanzó el viernes un 0,13% y cerró en S/ 3,793. A nivel internacional, el dólar caía luego de que el gobierno y los bancos en Estados Unidos coloquen salvavidas para aliviar la tensión en el sistema financiero.Para Maciel, la incertidumbre genera que el mercado cambie sus expectativas y la preocupación sobre la situación del sistema financiero en Estados Unidos genera una mayor aversión al riesgo.“El contexto motiva a los inversionistas a preferir activos más seguros. De escalar el problema en las principales instituciones financieras, se generaría mayor volatilidad en el mercado cambiario y podría llevar a una apreciación de dólar”, añadió."
