URL,Título,Fecha,Cuerpo
https://elcomercio.pe/economia/mercados/precio-del-dolar-hoy-en-peru-cotizacion-y-tipo-de-cambio-del-viernes-30-de-junio-segun-el-bcrp-ultimas-noticia/,"Precio del dólar HOY en Perú: A cómo se cotiza el tipo de cambio este viernes 30 de junio, según el BCRP",30/06/2023 14H30,"Redacción Economía30/06/2023 14H30Conoce en esta nota el precio del dólar en Perú hoy, viernes 30 de junio de 2023, según la información que dé a conocer el Banco Central de Reserva del Perú (BCRP). Este día ha sido declarado no laborable por el Gobierno peruano para incentivar el turismo, considerando que ayer, jueves 29, fue feriado nacional por el Día de San Pedro y San Pablo.En su última jornada, miércoles 28 de junio, la moneda estadounidense cerró en el mercado peruano con un valor de S/3,6330, de acuerdo con lo informado por el ente emisor.De acuerdo con el BCRP, el tipo de cambio interbancario tuvo un valor promedio de S/3,6316, con un mínimo de S/3,6270 y un máximo de S/3,6350.Así cerró el dólar el miércoles 28 de junio#BCRP: Información del Mercado Cambiario a las 13:30 horas pic.twitter.com/nrnnzDdP5g— Banco Central de Reserva del Perú - BCRP (@bcrpoficial) June 28, 2023 Si deseas hacer el tipo de cambio en plataformas web como cuantocuestaeldolar.pe, el tipo de cambio para hoy, jueves 29 de junio, es S/ 3,62 y S/ 3,64, en compra y venta respectivamente.¿Cómo le fue al dólar en junio?En la jornada del viernes 23 de junio, el dólar cerró en S/ 3,6360, en un contexto local que mostraba un clima de menor incertidumbre y volatilidad, según Matías Maciel, cofounder de Rextie.“Estimamos que esta tendencia estable o levemente hacia la baja continúe en los próximos días. Si bien no le encontramos mucho más recorrido hacia la baja, no vemos escenarios de subas relevantes en el precio de la moneda estadounidense”, dijo.Hace unos días, el Instituto Nacional de Estadística e Informática (INEI) dio a conocer en su último informe la tasa de crecimiento del PBI de abril, la que registró una variación positiva de 0,31%.La FED mantuvo su nivel de tasa de interés en el rango de 5% a 5,25%, en línea con las expectativas del mercado.Y, finalmente, el BCR redujo la proyección de la inversión privada para este año con una contracción de 2,5% y una recuperación en el segundo semestre."
https://elcomercio.pe/economia/mercados/dolar-today-y-monitor-dolar-hoy-miercoles-28-de-junio-conoce-la-cotizacion-del-dolar-en-venezuela-ultimas-noticia/,"Dólar Today y Monitor Dólar hoy, miércoles 28 de junio: Precio y cotización del dólar en Venezuela",28/06/2023 21H36,"Redacción EC28/06/2023 21H36Revisa AQUÍ el precio del dólar en Venezuela, según DólarToday y Monitor Dólar, que se reportó con un valor de 29,7 bolívares digitales en la jornada previa de junio 2023. En esta nota podrás conocer los movimientos y el valor del dólar o billete verde en el territorio venezolano para la jornada de hoy, miércoles 28 de junio del 2023.¿EN CUÁNTO ESTÁ EL DÓLAR HOY EN VENEZUELA?El dólar se situaba en 29,7 bolívares digitales en su última jornada en el mercado informal de Venezuela, de acuerdos a datos del portal DolarToday.En tanto, Monitor Dólar cotizó la moneda estadounidense con un precio de 28,40 bolívares digitales.Asimismo, el dólar BCV (Tasa del dólar oficial) tuvo un valor de 27,61 bolívares digitales, mientras que el dólar Bitcoin llegó a 29,68 bolívares digitales.¿A CUÁNTO CERRÓ EL DÓLAR EN VENEZUELA?De acuerdo a DólarToday, en la última jornada de junio de 2023, el dólar en Venezuela cerró en 29,7 bolívares digitales.¿QUÉ ES EL BOLÍVAR DIGITAL?Es la divisa que rige en el país tras la tercera reconversión monetaria que se aplicó desde el Gobierno. La nueva medida implicó que por cada millón de bolívares soberanos se obtendría un bolívar digital o, lo que es lo mismo, se borran seis ceros de las cantidades anteriormente dibujadas.¿QUÉ ES DÓLAR TODAY?Es una compañía venezolana-estadounidense de medios de comunicación, dirigida por venezolanos que residen en Estados Unidos, que centra su atención en temas de política y finanzas de Venezuela.¿QUÉ ES MONITOR DÓLAR?Monitor Dólar es una plataforma que publica a diario el promedio del dólar en Venezuela en el mercado paralelo de divisas."
https://elcomercio.pe/economia/mercados/precio-del-dolar-peru-tipo-de-cambio-18-de-mayo-2023-noticia/,"Dólar en Perú hoy, jueves 18 de mayo: Revisa a cómo se cotiza el tipo de cambio en las apps gratuitas",18/05/2023 15H29,"Redacción EC18/05/2023 15H29Cotización del dólar en Perú | El precio del dólar en el Perú y sus variaciones diarias constituyen una de las búsquedas más recurrentes de los ciudadanos en Internet, especialmente en canales oficiales como el Banco Central de Reserva del Perú (BCRP) y la Superintendencia de Banca, Seguros y AFP (SBS).Es de sumo interés para los ciudadanos peruanos conocer el precio y tipo de cambio de la moneda estadounidense, conocida también como el billete verde, sobre todo cuando tienen que realizar una importante transacción en compra o venta de esa importante divisa.MIRA: Club de suscriptores: Aprovecha nuestras promociones en Rextie, Kambista, Dollar House y TKambio. ¿Aún no eres suscriptor? Suscríbete a El Comercio Y en el país, por supuesto, esto no es la excepción, pues los consumidores están siempre al pendiente de cuál es el precio de esta divisa y cómo va el tipo de cambio en el mercado.¿A cuánto cerró el dólar en Perú en su última jornada de mayo?El precio del dólar estadounidense en el Perú cerró el miércoles 17 de mayo a S/3,6970, según lo dio a conocer el Banco Central de Reserva del Perú (BCRP).La cotización promedio del dólar en ese día fue de S/ 3,6954 a nivel interbancario, con un mínimo de S/ 3,6900 y un máximo de S/ 3,6990, según el BCR.¿Cuánto está el dólar en Lima?Este fue el reporte de la cotización del tipo de cambio que dio a conocer el BCRP en su última jornada:#BCRP: Información del Mercado Cambiario pic.twitter.com/yCg3FlhZMg— Banco Central de Reserva del Perú - BCRP (@bcrpoficial) May 17, 2023 ¿Cómo saber el precio del dólar en apps gratuitas de cambio?A continuación, te presentamos algunas plataformas de Internet en las que podrás realizar la conversión de soles a dólares y a otras monedas internacionales.Son completamente gratuitas y fáciles de utilizar.OANDAXE.COMCUEX.COM¿Dónde ver el precio del dólar?La cotización del cierre oficial del día se encuentra en la página web de la Superintendencia de Banca, Seguros y AFP (SBS).¿Cuál es la diferencia entre el precio de compra y venta del dólar?• Precio de compra: lo que el comprador está dispuesto a pagar por adquirir el activo.• Precio de venta: lo que el vendedor está dispuesto a recibir por vender el activo.¿De qué depende el precio del dólar?El precio del dólar depende de la oferta y demanda del mercado. Qué tan difícil es conseguirlo para alguien que lo necesita y que tan fácil es venderlo para alguien que lo tiene."
https://elcomercio.pe/economia/mercados/precio-del-dolar-peru-tipo-de-cambio-18-de-mayo-2023-noticia/,"Dólar en Perú hoy, jueves 18 de mayo: Revisa a cómo se cotiza el tipo de cambio en las apps gratuitas",18/05/2023 15H29,"Redacción EC18/05/2023 15H29Cotización del dólar en Perú | El precio del dólar en el Perú y sus variaciones diarias constituyen una de las búsquedas más recurrentes de los ciudadanos en Internet, especialmente en canales oficiales como el Banco Central de Reserva del Perú (BCRP) y la Superintendencia de Banca, Seguros y AFP (SBS).Es de sumo interés para los ciudadanos peruanos conocer el precio y tipo de cambio de la moneda estadounidense, conocida también como el billete verde, sobre todo cuando tienen que realizar una importante transacción en compra o venta de esa importante divisa.MIRA: Club de suscriptores: Aprovecha nuestras promociones en Rextie, Kambista, Dollar House y TKambio. ¿Aún no eres suscriptor? Suscríbete a El Comercio Y en el país, por supuesto, esto no es la excepción, pues los consumidores están siempre al pendiente de cuál es el precio de esta divisa y cómo va el tipo de cambio en el mercado.¿A cuánto cerró el dólar en Perú en su última jornada de mayo?El precio del dólar estadounidense en el Perú cerró el miércoles 17 de mayo a S/3,6970, según lo dio a conocer el Banco Central de Reserva del Perú (BCRP).La cotización promedio del dólar en ese día fue de S/ 3,6954 a nivel interbancario, con un mínimo de S/ 3,6900 y un máximo de S/ 3,6990, según el BCR.¿Cuánto está el dólar en Lima?Este fue el reporte de la cotización del tipo de cambio que dio a conocer el BCRP en su última jornada:#BCRP: Información del Mercado Cambiario pic.twitter.com/yCg3FlhZMg— Banco Central de Reserva del Perú - BCRP (@bcrpoficial) May 17, 2023 ¿Cómo saber el precio del dólar en apps gratuitas de cambio?A continuación, te presentamos algunas plataformas de Internet en las que podrás realizar la conversión de soles a dólares y a otras monedas internacionales.Son completamente gratuitas y fáciles de utilizar.OANDAXE.COMCUEX.COM¿Dónde ver el precio del dólar?La cotización del cierre oficial del día se encuentra en la página web de la Superintendencia de Banca, Seguros y AFP (SBS).¿Cuál es la diferencia entre el precio de compra y venta del dólar?• Precio de compra: lo que el comprador está dispuesto a pagar por adquirir el activo.• Precio de venta: lo que el vendedor está dispuesto a recibir por vender el activo.¿De qué depende el precio del dólar?El precio del dólar depende de la oferta y demanda del mercado. Qué tan difícil es conseguirlo para alguien que lo necesita y que tan fácil es venderlo para alguien que lo tiene."
https://elcomercio.pe/economia/mercados/que-paso-con-el-dolar-esta-semana-tdx-tipo-de-cambioo-dolar-en-el-peru-dolar-peru-noticia/,¿Qué pasó con el dólar esta semana?,18/03/2023 08H00,"Redacción Economía18/03/2023 08H00En lo que va de marzo, la cotización del dólar se mantiene relativamente estable y esta semana los mercados financieros a nivel global enfrentaron un escenario de incertidumbre por los recientes problemas que atraviesan algunos de los bancos en Estados Unidos, como el Silicon Valley Bank (SVB), anotó Matías Maciel, CFO y cofundador de Rextie.Así, la semana inició con el dólar cotizando en S/ 3,798, un avance de 0,42% respecto al cierre del viernes anterior. Durante el día el dólar caía a nivel internacional por las expectativas de que la Reserva Federal (FED) se muestre menos agresiva con su política monetaria para frenar la inflación.TAMBIÉN LEE | ¿Cuál es la situación de los pequeños negocios en el norte del país y qué efectos se ven en Lima?“Después de que las acciones del SVB cayeron más de 81%, durante el fin de semana pasado se anunciaron una serie de medidas para estabilizar el sistema bancario y afirmaron que los depositantes tendrían acceso a sus depósitos ese mismo lunes”, explicó Asvim Asencios, trader de Divisas de Renta4 SAB.El martes, el precio del dólar cerró en S/ 3,787, retrocediendo 0,29%. A nivel internacional el cobre caía debido a la preocupación sobre el impacto de una crisis bancaria en Estados Unidos, el fortalecimiento del dólar a nivel global y una lenta recuperación de la economía China, señalaron desde Renta4 SAB.Ese día se publicaron los datos del Índice de Precios al Consumidor de Estados Unidos que impulsaron la subida del dólar.MIRA | ¿Cómo se están adecuando los grifos para la venta de gasolina regular y premium?Con un avance de 0,53% cerró el tipo de cambio el miércoles al cotizar en S/ 3,807. Ese día, el dólar ganaba posiciones debido al riesgo percibido por los inversores ante la preocupación de una mayor inestabilidad del sector bancario. “En tanto el cobre recortaba sus posiciones en 2,9%, el rendimiento de los bonos del Tesoro de Estados Unidos a dos años cayó a su nivel más bajo desde setiembre”, informaron desde Renta4 SAB.El jueves, la cotización del tipo de cambio cerró en S/ 3,788, retrocediendo en 0,5%. El euro subía a nivel internacional luego de que el Banco Central Europeo (BCE) suba en 50 puntos básicos su tasa de referencia.TAMBIÉN LEE | Daños en caminos y carreteras causan pérdidas millonarias a la economía del norte del paísFinalmente, el tipo de cambio avanzó el viernes un 0,13% y cerró en S/ 3,793. A nivel internacional, el dólar caía luego de que el gobierno y los bancos en Estados Unidos coloquen salvavidas para aliviar la tensión en el sistema financiero.Para Maciel, la incertidumbre genera que el mercado cambie sus expectativas y la preocupación sobre la situación del sistema financiero en Estados Unidos genera una mayor aversión al riesgo.“El contexto motiva a los inversionistas a preferir activos más seguros. De escalar el problema en las principales instituciones financieras, se generaría mayor volatilidad en el mercado cambiario y podría llevar a una apreciación de dólar”, añadió."
https://elcomercio.pe/economia/mercados/que-paso-con-el-dolar-esta-semana-tdx-tipo-de-cambioo-dolar-en-el-peru-dolar-peru-noticia/,¿Qué pasó con el dólar esta semana?,18/03/2023 08H00,"Redacción Economía18/03/2023 08H00En lo que va de marzo, la cotización del dólar se mantiene relativamente estable y esta semana los mercados financieros a nivel global enfrentaron un escenario de incertidumbre por los recientes problemas que atraviesan algunos de los bancos en Estados Unidos, como el Silicon Valley Bank (SVB), anotó Matías Maciel, CFO y cofundador de Rextie.Así, la semana inició con el dólar cotizando en S/ 3,798, un avance de 0,42% respecto al cierre del viernes anterior. Durante el día el dólar caía a nivel internacional por las expectativas de que la Reserva Federal (FED) se muestre menos agresiva con su política monetaria para frenar la inflación.TAMBIÉN LEE | ¿Cuál es la situación de los pequeños negocios en el norte del país y qué efectos se ven en Lima?“Después de que las acciones del SVB cayeron más de 81%, durante el fin de semana pasado se anunciaron una serie de medidas para estabilizar el sistema bancario y afirmaron que los depositantes tendrían acceso a sus depósitos ese mismo lunes”, explicó Asvim Asencios, trader de Divisas de Renta4 SAB.El martes, el precio del dólar cerró en S/ 3,787, retrocediendo 0,29%. A nivel internacional el cobre caía debido a la preocupación sobre el impacto de una crisis bancaria en Estados Unidos, el fortalecimiento del dólar a nivel global y una lenta recuperación de la economía China, señalaron desde Renta4 SAB.Ese día se publicaron los datos del Índice de Precios al Consumidor de Estados Unidos que impulsaron la subida del dólar.MIRA | ¿Cómo se están adecuando los grifos para la venta de gasolina regular y premium?Con un avance de 0,53% cerró el tipo de cambio el miércoles al cotizar en S/ 3,807. Ese día, el dólar ganaba posiciones debido al riesgo percibido por los inversores ante la preocupación de una mayor inestabilidad del sector bancario. “En tanto el cobre recortaba sus posiciones en 2,9%, el rendimiento de los bonos del Tesoro de Estados Unidos a dos años cayó a su nivel más bajo desde setiembre”, informaron desde Renta4 SAB.El jueves, la cotización del tipo de cambio cerró en S/ 3,788, retrocediendo en 0,5%. El euro subía a nivel internacional luego de que el Banco Central Europeo (BCE) suba en 50 puntos básicos su tasa de referencia.TAMBIÉN LEE | Daños en caminos y carreteras causan pérdidas millonarias a la economía del norte del paísFinalmente, el tipo de cambio avanzó el viernes un 0,13% y cerró en S/ 3,793. A nivel internacional, el dólar caía luego de que el gobierno y los bancos en Estados Unidos coloquen salvavidas para aliviar la tensión en el sistema financiero.Para Maciel, la incertidumbre genera que el mercado cambie sus expectativas y la preocupación sobre la situación del sistema financiero en Estados Unidos genera una mayor aversión al riesgo.“El contexto motiva a los inversionistas a preferir activos más seguros. De escalar el problema en las principales instituciones financieras, se generaría mayor volatilidad en el mercado cambiario y podría llevar a una apreciación de dólar”, añadió."
https://elcomercio.pe/economia/mercados/dolar-en-peru-hoy-domingo-19-de-febrero-revisa-el-tipo-de-cambio-y-cotizacion-sbs-bscr-tdex-noticia/,"Dólar en Perú hoy, 19 de febrero: Consulta el tipo de cambio y cotización en compra y venta",19/02/2023 14H41,"Redacción EC19/02/2023 14H41A continuación, conoce cómo cerró el precio del dólar estadounidense en el Perú en la jornada de hoy, domingo 19 de febrero de 2023. De acuerdo con el Banco Central de Reserva (BCR), el billete verde cerró la jornada con un valor de S/3,8460.¿A cuánto está el dólar?La cotización promedio del dólar el 19 de febrero del 2023, pasó de S/ 3,85 a S/ 3,84 a nivel interbancario, según informó el Banco Central de Reserva (BCR).Por otro lado, las casas de cambio y agencias presentan el tipo de cambio en compra y venta en S/. 3.835 y S/. 3.86, respectivamente; según da a conocer el portal cuantoestaeldolar.pe.¿Cuánto está el dólar en el Perú?El tipo de cambio empezó la jornada del sábado 18 de febrero en S/ 3.8505 por dólar, un ligero avance frente al cierre del de su última sesión en S/ 3.8500, de acuerdo a datos del BCR.En lo que va del año 2023, la moneda estadounidense acumula 1,02% en comparación con la última cotización de 2022, en S/3,807.El actual precio del dólar estadounidense en el Perú se mantendrá hasta el inicio del próximo mercado cambiario en el país que iniciará a las 09:00 a.m. de la próxima jornada."
https://elcomercio.pe/economia/mercados/dolar-en-peru-hoy-domingo-19-de-febrero-revisa-el-tipo-de-cambio-y-cotizacion-sbs-bscr-tdex-noticia/,"Dólar en Perú hoy, 19 de febrero: Consulta el tipo de cambio y cotización en compra y venta",19/02/2023 14H41,"Redacción EC19/02/2023 14H41A continuación, conoce cómo cerró el precio del dólar estadounidense en el Perú en la jornada de hoy, domingo 19 de febrero de 2023. De acuerdo con el Banco Central de Reserva (BCR), el billete verde cerró la jornada con un valor de S/3,8460.¿A cuánto está el dólar?La cotización promedio del dólar el 19 de febrero del 2023, pasó de S/ 3,85 a S/ 3,84 a nivel interbancario, según informó el Banco Central de Reserva (BCR).Por otro lado, las casas de cambio y agencias presentan el tipo de cambio en compra y venta en S/. 3.835 y S/. 3.86, respectivamente; según da a conocer el portal cuantoestaeldolar.pe.¿Cuánto está el dólar en el Perú?El tipo de cambio empezó la jornada del sábado 18 de febrero en S/ 3.8505 por dólar, un ligero avance frente al cierre del de su última sesión en S/ 3.8500, de acuerdo a datos del BCR.En lo que va del año 2023, la moneda estadounidense acumula 1,02% en comparación con la última cotización de 2022, en S/3,807.El actual precio del dólar estadounidense en el Perú se mantendrá hasta el inicio del próximo mercado cambiario en el país que iniciará a las 09:00 a.m. de la próxima jornada."
https://elcomercio.pe/economia/mercados/dolar-hoy-en-peru-a-cuanto-se-cotiza-el-tipo-de-cambio-este-sabado-18-de-febrero-sbs-bcr-tdex-noticia/,"Dólar en Perú hoy, sábado 18 de febrero: Consulta AQUÍ el tipo de cambio y cotización",18/02/2023 09H07,"Redacción EC18/02/2023 09H07A continuación, conoce cómo cerró el precio del dólar estadounidense en el Perú en la jornada de hoy, sábado 18 de febrero de 2023. De acuerdo con el Banco Central de Reserva (BCR), el billete verde cerró la jornada con un valor de S/3,8460.¿A cuánto está el dólar?La cotización promedio del dólar el 18 de febrero del 2023, pasó de S/ 3,85 a S/ 3,84 a nivel interbancario, según informó el Banco Central de Reserva (BCR).Por otro lado, las casas de cambio y agencias presentan el tipo de cambio en compra y venta en S/. 3.835 y S/. 3.86, respectivamente; según da a conocer el portal cuantoestaeldolar.pe.¿Cuánto está el dólar en el Perú?El tipo de cambio empezó la jornada del sábado 18 de febrero en S/ 3.8505 por dólar, un ligero avance frente al cierre del de su última sesión (jueves 16) en S/ 3.8500, de acuerdo a datos del BCR.En lo que va del año 2023, la moneda estadounidense acumula 1,02% en comparación con la última cotización de 2022, en S/3,807.El actual precio del dólar estadounidense en el Perú se mantendrá hasta el inicio del próximo mercado cambiario en el país que iniciará a las 09:00 a.m. de la próxima jornada."
https://elcomercio.pe/economia/mercados/dolar-hoy-en-peru-a-cuanto-se-cotiza-el-tipo-de-cambio-este-sabado-18-de-febrero-sbs-bcr-tdex-noticia/,"Dólar en Perú hoy, sábado 18 de febrero: Consulta AQUÍ el tipo de cambio y cotización",18/02/2023 09H07,"Redacción EC18/02/2023 09H07A continuación, conoce cómo cerró el precio del dólar estadounidense en el Perú en la jornada de hoy, sábado 18 de febrero de 2023. De acuerdo con el Banco Central de Reserva (BCR), el billete verde cerró la jornada con un valor de S/3,8460.¿A cuánto está el dólar?La cotización promedio del dólar el 18 de febrero del 2023, pasó de S/ 3,85 a S/ 3,84 a nivel interbancario, según informó el Banco Central de Reserva (BCR).Por otro lado, las casas de cambio y agencias presentan el tipo de cambio en compra y venta en S/. 3.835 y S/. 3.86, respectivamente; según da a conocer el portal cuantoestaeldolar.pe.¿Cuánto está el dólar en el Perú?El tipo de cambio empezó la jornada del sábado 18 de febrero en S/ 3.8505 por dólar, un ligero avance frente al cierre del de su última sesión (jueves 16) en S/ 3.8500, de acuerdo a datos del BCR.En lo que va del año 2023, la moneda estadounidense acumula 1,02% en comparación con la última cotización de 2022, en S/3,807.El actual precio del dólar estadounidense en el Perú se mantendrá hasta el inicio del próximo mercado cambiario en el país que iniciará a las 09:00 a.m. de la próxima jornada."
https://elcomercio.pe/economia/mercados/dolar-en-peru-y-tipo-de-cambio-para-hoy-viernes-17-de-febrero-2023-compra-y-venta-dolares-a-soles-de-hoy-bcr-banco-central-de-reserva-noticia/,Dólar hoy en Perú: ¿A cuánto cerró el tipo de cambio el viernes 17 de febrero?,17/02/2023 20H33,"Redacción EC17/02/2023 20H33A continuación, conoce cómo cerró el precio del dólar estadounidense en el Perú en la jornada de hoy, viernes 17 de febrero de 2023. De acuerdo con el Banco Central de Reserva (BCR), el billete verde cerró la jornada con un valor de S/3,8460.¿A cuánto está el dólar?La cotización promedio del dólar el 17 de febrero del 2023, pasó de S/ 3,85 a S/ 3,84 a nivel interbancario, según informó el Banco Central de Reserva (BCR).Por otro lado, las casas de cambio y agencias presentan el tipo de cambio en compra y venta en S/. 3.835 y S/. 3.86, respectivamente; según da a conocer el portal cuantoestaeldolar.pe.¿Cuánto está el dólar en el Perú?El tipo de cambio empezó la jornada del viernes 17 de febrero en S/ 3.8505 por dólar, un ligero avance frente al cierre del de su última sesión (jueves 16) en S/ 3.8500, de acuerdo a datos del BCR. En lo que va del año 2023, la moneda estadounidense acumula 1,02% en comparación con la última cotización de 2022, en S/3,807.El actual precio del dólar estadounidense en el Perú se mantendrá hasta el inicio del próximo mercado cambiario en el país que iniciará a las 09:00 a.m. de la próxima jornada."
https://elcomercio.pe/economia/mercados/dolar-en-peru-y-tipo-de-cambio-para-hoy-viernes-17-de-febrero-2023-compra-y-venta-dolares-a-soles-de-hoy-bcr-banco-central-de-reserva-noticia/,Dólar hoy en Perú: ¿A cuánto cerró el tipo de cambio el viernes 17 de febrero?,17/02/2023 20H33,"Redacción EC17/02/2023 20H33A continuación, conoce cómo cerró el precio del dólar estadounidense en el Perú en la jornada de hoy, viernes 17 de febrero de 2023. De acuerdo con el Banco Central de Reserva (BCR), el billete verde cerró la jornada con un valor de S/3,8460.¿A cuánto está el dólar?La cotización promedio del dólar el 17 de febrero del 2023, pasó de S/ 3,85 a S/ 3,84 a nivel interbancario, según informó el Banco Central de Reserva (BCR).Por otro lado, las casas de cambio y agencias presentan el tipo de cambio en compra y venta en S/. 3.835 y S/. 3.86, respectivamente; según da a conocer el portal cuantoestaeldolar.pe.¿Cuánto está el dólar en el Perú?El tipo de cambio empezó la jornada del viernes 17 de febrero en S/ 3.8505 por dólar, un ligero avance frente al cierre del de su última sesión (jueves 16) en S/ 3.8500, de acuerdo a datos del BCR. En lo que va del año 2023, la moneda estadounidense acumula 1,02% en comparación con la última cotización de 2022, en S/3,807.El actual precio del dólar estadounidense en el Perú se mantendrá hasta el inicio del próximo mercado cambiario en el país que iniciará a las 09:00 a.m. de la próxima jornada."
